{
  "artifact_paths": [
    "system/runtime/upbit/krw_spot/paper/mvp1_upbit_paper_launcher/ledger/cycles/debug-profile-schema-mismatch-20260506T124140Z-cycle-1.paper_ledger_events.jsonl",
    "system/runtime/upbit/krw_spot/paper/mvp1_upbit_paper_launcher/ledger/cycles/debug-profile-schema-mismatch-20260506T124140Z-cycle-2.paper_ledger_events.jsonl",
    "system/runtime/upbit/krw_spot/paper/mvp1_upbit_paper_launcher/ledger/cycles/mvp4-candidate-scorecard-runtime-linkage-binding-cycle-1.paper_ledger_events.jsonl",
    "system/runtime/upbit/krw_spot/paper/mvp1_upbit_paper_launcher/ledger/cycles/mvp4-candidate-scorecard-runtime-linkage-binding-cycle-2.paper_ledger_events.jsonl",
    "system/runtime/upbit/krw_spot/paper/mvp1_upbit_paper_launcher/ledger/cycles/mvp4-ledger-jsonl-recovery-ui-refresh-cycle-1.paper_ledger_events.jsonl",
    "system/runtime/upbit/krw_spot/paper/mvp1_upbit_paper_launcher/ledger/cycles/mvp4-paper-current-truth-dashboard-freshness-20260506T124126Z-cycle-1.paper_ledger_events.jsonl",
    "system/runtime/upbit/krw_spot/paper/mvp1_upbit_paper_launcher/ledger/cycles/mvp4-paper-current-truth-dashboard-freshness-20260506T124126Z-cycle-2.paper_ledger_events.jsonl",
    "system/runtime/upbit/krw_spot/paper/mvp1_upbit_paper_launcher/ledger/cycles/mvp4-paper-current-truth-dashboard-freshness-20260506T124301Z-cycle-1.paper_ledger_events.jsonl",
    "system/runtime/upbit/krw_spot/paper/mvp1_upbit_paper_launcher/ledger/cycles/mvp4-paper-current-truth-dashboard-freshness-20260506T124301Z-cycle-2.paper_ledger_events.jsonl",
    "system/runtime/upbit/krw_spot/paper/mvp1_upbit_paper_launcher/ledger/cycles/mvp4-paper-ledger-rollup-ui-refresh-cycle-1.paper_ledger_events.jsonl",
    "system/runtime/upbit/krw_spot/paper/mvp1_upbit_paper_launcher/ledger/cycles/mvp4-paper-ledger-rollup-ui-refresh-cycle-2.paper_ledger_events.jsonl",
    "system/runtime/upbit/krw_spot/paper/mvp1_upbit_paper_launcher/ledger/cycles/mvp4-paper-runtime-refresh-20260506T121730Z-cycle-1.paper_ledger_events.jsonl",
    "system/runtime/upbit/krw_spot/paper/mvp1_upbit_paper_launcher/ledger/cycles/mvp4-paper-runtime-refresh-20260506T121730Z-cycle-2.paper_ledger_events.jsonl",
    "system/runtime/upbit/krw_spot/paper/mvp1_upbit_paper_launcher/ledger/cycles/mvp4-paper-runtime-refresh-20260506T121926Z-cycle-1.paper_ledger_events.jsonl",
    "system/runtime/upbit/krw_spot/paper/mvp1_upbit_paper_launcher/ledger/cycles/mvp4-paper-runtime-refresh-20260506T121926Z-cycle-2.paper_ledger_events.jsonl",
    "system/runtime/upbit/krw_spot/paper/mvp1_upbit_paper_launcher/ledger/cycles/mvp4-paper-runtime-sample-history-invalid-source-exclusion-20260506T000000Z-cycle-1.paper_ledger_events.jsonl",
    "system/runtime/upbit/krw_spot/paper/mvp1_upbit_paper_launcher/ledger/cycles/mvp4-paper-runtime-sample-history-invalid-source-exclusion-20260506T000000Z-cycle-2.paper_ledger_events.jsonl",
    "system/runtime/upbit/krw_spot/paper/mvp1_upbit_paper_launcher/ledger/cycles/mvp4-post-rerun-reconciliation-recheck-runtime-depth-cycle-1.paper_ledger_events.jsonl",
    "system/runtime/upbit/krw_spot/paper/mvp1_upbit_paper_launcher/ledger/cycles/mvp4-profitability-evidence-runtime-linkage-cycle-1.paper_ledger_events.jsonl",
    "system/runtime/upbit/krw_spot/paper/mvp1_upbit_paper_launcher/ledger/cycles/mvp4-profitability-evidence-runtime-linkage-cycle-2.paper_ledger_events.jsonl",
    "system/runtime/upbit/krw_spot/paper/mvp1_upbit_paper_launcher/ledger/cycles/mvp4-strategy-regime-cost-runtime-linkage-cycle-1.paper_ledger_events.jsonl",
    "system/runtime/upbit/krw_spot/paper/mvp1_upbit_paper_launcher/ledger/cycles/mvp4-strategy-regime-cost-runtime-linkage-cycle-2.paper_ledger_events.jsonl",
    "system/runtime/upbit/krw_spot/paper/mvp1_upbit_paper_launcher/ledger/cycles/mvp4-summary-portfolio-provenance-guard-cycle-1.paper_ledger_events.jsonl",
    "system/runtime/upbit/krw_spot/paper/mvp1_upbit_paper_launcher/ledger/cycles/mvp4-upbit-market-data-pointer-schema-guard-cycle-1.paper_ledger_events.jsonl",
    "system/runtime/upbit/krw_spot/paper/mvp1_upbit_paper_launcher/ledger/cycles/mvp4-upbit-paper-ledger-head-binding-guard-cycle-1.paper_ledger_events.jsonl",
    "system/runtime/upbit/krw_spot/paper/mvp1_upbit_paper_launcher/ledger/cycles/mvp4-upbit-paper-ledger-head-binding-guard-cycle-2.paper_ledger_events.jsonl",
    "system/runtime/upbit/krw_spot/paper/mvp1_upbit_paper_launcher/ledger/cycles/mvp4-upbit-paper-ledger-rollup-consistency-guard-cycle-1.paper_ledger_events.jsonl",
    "system/runtime/upbit/krw_spot/paper/mvp1_upbit_paper_launcher/ledger/cycles/mvp4-upbit-paper-ledger-rollup-consistency-guard-cycle-2.paper_ledger_events.jsonl",
    "system/runtime/upbit/krw_spot/paper/mvp1_upbit_paper_launcher/ledger/cycles/mvp4-upbit-paper-long-run-evidence-boundary-cycle-1.paper_ledger_events.jsonl",
    "system/runtime/upbit/krw_spot/paper/mvp1_upbit_paper_launcher/ledger/cycles/mvp4-upbit-paper-long-run-evidence-boundary-cycle-2.paper_ledger_events.jsonl",
    "system/runtime/upbit/krw_spot/paper/mvp1_upbit_paper_launcher/ledger/cycles/mvp4-upbit-paper-runtime-e2e-consistency-guard-cycle-1.paper_ledger_events.jsonl",
    "system/runtime/upbit/krw_spot/paper/mvp1_upbit_paper_launcher/ledger/cycles/mvp4-upbit-paper-runtime-e2e-consistency-guard-cycle-2.paper_ledger_events.jsonl",
    "system/runtime/upbit/krw_spot/paper/mvp1_upbit_paper_launcher/ledger/cycles/mvp4-upbit-paper-runtime-ledger-lifecycle-reconciliation-cycle-1.paper_ledger_events.jsonl",
    "system/runtime/upbit/krw_spot/paper/mvp1_upbit_paper_launcher/ledger/cycles/mvp4-upbit-paper-runtime-ledger-lifecycle-reconciliation-cycle-2.paper_ledger_events.jsonl",
    "system/runtime/upbit/krw_spot/paper/mvp1_upbit_paper_launcher/ledger/cycles/mvp4-upbit-runtime-source-hash-guard-cycle-1.paper_ledger_events.jsonl",
    "system/runtime/upbit/krw_spot/paper/mvp1_upbit_paper_launcher/ledger/cycles/mvp4_dashboard_stale_rollup_truth_guard_current_refresh-cycle-1.paper_ledger_events.jsonl",
    "system/runtime/upbit/krw_spot/paper/mvp1_upbit_paper_launcher/ledger/cycles/mvp4_dashboard_stale_rollup_truth_guard_current_refresh-cycle-2.paper_ledger_events.jsonl",
    "system/runtime/upbit/krw_spot/paper/mvp1_upbit_paper_launcher/ledger/cycles/mvp4_upbit_candidate_decision_guard_current_refresh-cycle-1.paper_ledger_events.jsonl",
    "system/runtime/upbit/krw_spot/paper/mvp1_upbit_paper_launcher/ledger/cycles/mvp4_upbit_candidate_decision_guard_current_refresh-cycle-2.paper_ledger_events.jsonl",
    "system/runtime/upbit/krw_spot/paper/mvp1_upbit_paper_launcher/ledger/cycles/mvp4_upbit_scorecard_bridge_current_refresh-cycle-1.paper_ledger_events.jsonl",
    "system/runtime/upbit/krw_spot/paper/mvp1_upbit_paper_launcher/ledger/cycles/mvp4_upbit_scorecard_bridge_current_refresh-cycle-2.paper_ledger_events.jsonl",
    "system/runtime/upbit/krw_spot/paper/mvp1_upbit_paper_launcher/ledger/cycles/robustness-sample-accumulator-20260506T132530Z-loop-1-cycle-1.paper_ledger_events.jsonl",
    "system/runtime/upbit/krw_spot/paper/mvp1_upbit_paper_launcher/ledger/cycles/robustness-sample-accumulator-20260506T132530Z-loop-1-cycle-10.paper_ledger_events.jsonl",
    "system/runtime/upbit/krw_spot/paper/mvp1_upbit_paper_launcher/ledger/cycles/robustness-sample-accumulator-20260506T132530Z-loop-1-cycle-11.paper_ledger_events.jsonl",
    "system/runtime/upbit/krw_spot/paper/mvp1_upbit_paper_launcher/ledger/cycles/robustness-sample-accumulator-20260506T132530Z-loop-1-cycle-12.paper_ledger_events.jsonl",
    "system/runtime/upbit/krw_spot/paper/mvp1_upbit_paper_launcher/ledger/cycles/robustness-sample-accumulator-20260506T132530Z-loop-1-cycle-13.paper_ledger_events.jsonl",
    "system/runtime/upbit/krw_spot/paper/mvp1_upbit_paper_launcher/ledger/cycles/robustness-sample-accumulator-20260506T132530Z-loop-1-cycle-14.paper_ledger_events.jsonl",
    "system/runtime/upbit/krw_spot/paper/mvp1_upbit_paper_launcher/ledger/cycles/robustness-sample-accumulator-20260506T132530Z-loop-1-cycle-15.paper_ledger_events.jsonl",
    "system/runtime/upbit/krw_spot/paper/mvp1_upbit_paper_launcher/ledger/cycles/robustness-sample-accumulator-20260506T132530Z-loop-1-cycle-16.paper_ledger_events.jsonl",
    "system/runtime/upbit/krw_spot/paper/mvp1_upbit_paper_launcher/ledger/cycles/robustness-sample-accumulator-20260506T132530Z-loop-1-cycle-17.paper_ledger_events.jsonl",
    "system/runtime/upbit/krw_spot/paper/mvp1_upbit_paper_launcher/ledger/cycles/robustness-sample-accumulator-20260506T132530Z-loop-1-cycle-18.paper_ledger_events.jsonl",
    "system/runtime/upbit/krw_spot/paper/mvp1_upbit_paper_launcher/ledger/cycles/robustness-sample-accumulator-20260506T132530Z-loop-1-cycle-19.paper_ledger_events.jsonl",
    "system/runtime/upbit/krw_spot/paper/mvp1_upbit_paper_launcher/ledger/cycles/robustness-sample-accumulator-20260506T132530Z-loop-1-cycle-2.paper_ledger_events.jsonl",
    "system/runtime/upbit/krw_spot/paper/mvp1_upbit_paper_launcher/ledger/cycles/robustness-sample-accumulator-20260506T132530Z-loop-1-cycle-20.paper_ledger_events.jsonl",
    "system/runtime/upbit/krw_spot/paper/mvp1_upbit_paper_launcher/ledger/cycles/robustness-sample-accumulator-20260506T132530Z-loop-1-cycle-3.paper_ledger_events.jsonl",
    "system/runtime/upbit/krw_spot/paper/mvp1_upbit_paper_launcher/ledger/cycles/robustness-sample-accumulator-20260506T132530Z-loop-1-cycle-4.paper_ledger_events.jsonl",
    "system/runtime/upbit/krw_spot/paper/mvp1_upbit_paper_launcher/ledger/cycles/robustness-sample-accumulator-20260506T132530Z-loop-1-cycle-5.paper_ledger_events.jsonl",
    "system/runtime/upbit/krw_spot/paper/mvp1_upbit_paper_launcher/ledger/cycles/robustness-sample-accumulator-20260506T132530Z-loop-1-cycle-6.paper_ledger_events.jsonl",
    "system/runtime/upbit/krw_spot/paper/mvp1_upbit_paper_launcher/ledger/cycles/robustness-sample-accumulator-20260506T132530Z-loop-1-cycle-7.paper_ledger_events.jsonl",